{
  "id": "drivers_license_information",
  "name": "Verify Valid License",
  "purpose": "We need you to show that your driver's license will be valid through December of this year.",
  "constraints": {
    "fields": [
      {
        "path": ["$.credentialSchema.id", "$.vc.credentialSchema.id"],
        "filter": {
          "type": "string",
          "const": "https://yourwatchful.gov/drivers-license-schema.json"
        }
      },
      {
        "path": ["$.expirationDate"],
        "filter": {
          "type": "string",
          "format": "date-time"
        }
      }
    ]
  }
}
